[
  {
    "id": "navaid",
    "code": "NAV",
    "iconClass": "nav",
    "name": "Navaid",
    "description": "Een radionavigatiehulpmiddel op de grond of in de lucht, gebruikt voor luchtvaartnavigatie. Omvat VOR, NDB, DME, ILS en TACAN installaties.",
    "badges": [
      "AIXM 5.1",
      "ADIS",
      "EASA"
    ],
    "aixmMapped": true,
    "group": "Navigatie",
    "attrs": [
      {
        "name": "designator",
        "type": "CHAR(5)",
        "status": "req",
        "desc": "Uniek identificatiekenmerk van de navaid",
        "uom": null,
        "aixm": "designator"
      },
      {
        "name": "type",
        "type": "ENUM",
        "status": "req",
        "desc": "Type navaid (VOR, NDB, DME, ILS, TACAN)",
        "uom": null,
        "aixm": "type"
      },
      {
        "name": "latitude",
        "type": "DECIMAL(10,7)",
        "status": "req",
        "desc": "Geografische breedtegraad WGS-84",
        "uom": "DEG",
        "aixm": "pos.lat"
      },
      {
        "name": "longitude",
        "type": "DECIMAL(10,7)",
        "status": "req",
        "desc": "Geografische lengtegraad WGS-84",
        "uom": "DEG",
        "aixm": "pos.lon"
      },
      {
        "name": "elevation",
        "type": "DECIMAL(7,2)",
        "status": "opt",
        "desc": "Hoogte boven gemiddeld zeeniveau (MSL)",
        "uom": "M / FT",
        "aixm": "elevation"
      },
      {
        "name": "frequency",
        "type": "DECIMAL(7,3)",
        "status": "cond",
        "desc": "Operationele frequentie. Verplicht voor VOR/NDB/ILS.",
        "uom": "MHZ / KHZ",
        "aixm": "frequency"
      },
      {
        "name": "channel",
        "type": "VARCHAR(4)",
        "status": "cond",
        "desc": "DME/TACAN kanaal. Verplicht voor DME/TACAN.",
        "uom": null,
        "aixm": "channel"
      },
      {
        "name": "declination",
        "type": "DECIMAL(5,2)",
        "status": "opt",
        "desc": "Magnetische declinatie op locatie",
        "uom": "DEG",
        "aixm": "magneticVariation"
      },
      {
        "name": "operationalStatus",
        "type": "ENUM",
        "status": "req",
        "desc": "Operationele status (OPERATIONAL, UNSERVICEABLE, UNDER_MAINTENANCE)",
        "uom": null,
        "aixm": "availability.operationalStatus"
      },
      {
        "name": "idsNonStandard",
        "type": "BOOLEAN",
        "status": "opt",
        "desc": "IDS niet-standaard attribuut: indicatie of dit een IDS-specifieke installatie is",
        "uom": null,
        "aixm": null
      }
    ],
    "relations": {
      "parent": [
        {
          "name": "AirportHeliport",
          "label": "Gerelateerde luchthaven",
          "type": "spatial"
        }
      ],
      "children": [
        {
          "name": "NavaidEquipment",
          "label": "Technische apparatuur",
          "type": "logical"
        },
        {
          "name": "NavaidOperationalHours",
          "label": "Operationele tijden",
          "type": "logical"
        }
      ],
      "spatial": [
        {
          "name": "AirportHeliport",
          "label": "Binnen luchthavengebied"
        },
        {
          "name": "Airspace",
          "label": "Gerelateerd luchtruim"
        }
      ],
      "logical": [
        {
          "name": "InstrumentApproachProcedure",
          "label": "Gebruikt in nadering",
          "type": "proc"
        },
        {
          "name": "RouteSegment",
          "label": "Gedefinieerd routesegment",
          "type": "proc"
        }
      ]
    },
    "mapping": [
      {
        "aerodb": "designator",
        "aixm": "Navaid.designator",
        "table": "NAV_AID",
        "column": "DESIGNATOR"
      },
      {
        "aerodb": "type",
        "aixm": "Navaid.type",
        "table": "NAV_AID",
        "column": "TYPE_CODE"
      },
      {
        "aerodb": "latitude",
        "aixm": "Navaid.position.lat",
        "table": "NAV_AID",
        "column": "LAT_DEG"
      },
      {
        "aerodb": "longitude",
        "aixm": "Navaid.position.lon",
        "table": "NAV_AID",
        "column": "LON_DEG"
      },
      {
        "aerodb": "frequency",
        "aixm": "Navaid.frequency",
        "table": "NAV_AID",
        "column": "FREQ_VAL"
      },
      {
        "aerodb": "idsNonStandard",
        "aixm": "— (IDS only)",
        "table": "NAV_AID_EXT",
        "column": "IDS_FLAG"
      }
    ],
    "ownership": [
      {
        "attr": "designator",
        "provider": "LVNL",
        "originator": "AIS Datamanager",
        "dpa": true
      },
      {
        "attr": "frequency",
        "provider": "LVNL / EUROCONTROL",
        "originator": "Technische Dienst",
        "dpa": true
      },
      {
        "attr": "elevation",
        "provider": "Kadaster",
        "originator": "Survey Team",
        "dpa": false
      },
      {
        "attr": "operationalStatus",
        "provider": "LVNL OPS",
        "originator": "Operationeel Centrum",
        "dpa": true
      }
    ],
    "adis": [
      {
        "module": "AIP Publisher",
        "attrs": [
          "designator",
          "type",
          "frequency"
        ],
        "reqAll": true
      },
      {
        "module": "FME GIS Export",
        "attrs": [
          "latitude",
          "longitude",
          "elevation"
        ],
        "reqAll": true
      },
      {
        "module": "NOTAM Generator",
        "attrs": [
          "designator",
          "operationalStatus"
        ],
        "reqAll": true
      },
      {
        "module": "CFMU Feed",
        "attrs": [
          "designator",
          "frequency",
          "channel"
        ],
        "reqAll": false
      },
      {
        "module": "Aeronautical DB Sync",
        "attrs": [
          "designator",
          "type",
          "latitude",
          "longitude"
        ],
        "reqAll": true
      }
    ]
  },
  {
    "id": "runway",
    "code": "RWY",
    "iconClass": "rwy",
    "name": "Runway",
    "description": "Een afgebakend rechthoekig oppervlak op een landterrein of waterspiegel, aangelegd voor het landen en opstijgen van luchtvaartuigen. Omvat alle fysieke en operationele kenmerken.",
    "badges": [
      "AIXM 5.1",
      "ADIS",
      "EASA"
    ],
    "aixmMapped": true,
    "group": "Luchthaven",
    "attrs": [
      {
        "name": "designator",
        "type": "CHAR(7)",
        "status": "req",
        "desc": "ICAO baanaanduiding (bijv. 18L/36R)",
        "uom": null,
        "aixm": "designator"
      },
      {
        "name": "length",
        "type": "DECIMAL(7,2)",
        "status": "req",
        "desc": "Totale baanlengte",
        "uom": "M",
        "aixm": "nominalLength"
      },
      {
        "name": "width",
        "type": "DECIMAL(5,2)",
        "status": "req",
        "desc": "Totale baanbreedte",
        "uom": "M",
        "aixm": "width"
      },
      {
        "name": "surface",
        "type": "ENUM",
        "status": "req",
        "desc": "Type verharding (ASPHALT, CONCRETE, GRAVEL, GRASS)",
        "uom": null,
        "aixm": "surfaceType"
      },
      {
        "name": "pcn",
        "type": "VARCHAR(20)",
        "status": "opt",
        "desc": "Pavement Classification Number",
        "uom": null,
        "aixm": "classificationNumber"
      },
      {
        "name": "slopeGradient",
        "type": "DECIMAL(5,3)",
        "status": "opt",
        "desc": "Hellingsgradiënt van de baan",
        "uom": "%",
        "aixm": "slope"
      },
      {
        "name": "trueBearing",
        "type": "DECIMAL(6,3)",
        "status": "req",
        "desc": "Ware koers van de baan",
        "uom": "DEG",
        "aixm": "trueBearing"
      },
      {
        "name": "elevationTDZ",
        "type": "DECIMAL(7,2)",
        "status": "opt",
        "desc": "Hoogte touchdownzone",
        "uom": "M",
        "aixm": "elevationTDZ"
      }
    ],
    "relations": {
      "parent": [
        {
          "name": "AirportHeliport",
          "label": "Behorend bij luchthaven",
          "type": "parent"
        }
      ],
      "children": [
        {
          "name": "RunwayDirection",
          "label": "Baanrichtingen (2x)",
          "type": "logical"
        },
        {
          "name": "RunwayProtectionArea",
          "label": "Beveiligingsgebieden",
          "type": "logical"
        }
      ],
      "spatial": [
        {
          "name": "ApronArea",
          "label": "Aangrenzend platformgebied"
        }
      ],
      "logical": [
        {
          "name": "InstrumentApproachProcedure",
          "label": "Naderingsprocedures"
        },
        {
          "name": "SID",
          "label": "Vertrekprocedures"
        }
      ]
    },
    "mapping": [
      {
        "aerodb": "designator",
        "aixm": "Runway.designator",
        "table": "RUNWAY",
        "column": "DESIGNATOR"
      },
      {
        "aerodb": "length",
        "aixm": "Runway.nominalLength",
        "table": "RUNWAY",
        "column": "LENGTH_M"
      },
      {
        "aerodb": "width",
        "aixm": "Runway.width",
        "table": "RUNWAY",
        "column": "WIDTH_M"
      },
      {
        "aerodb": "surface",
        "aixm": "Runway.surfaceType",
        "table": "RUNWAY",
        "column": "SURFACE_TYPE"
      }
    ],
    "ownership": [
      {
        "attr": "length",
        "provider": "Airport Operator",
        "originator": "Infrastructuur",
        "dpa": true
      },
      {
        "attr": "surface",
        "provider": "Airport Operator",
        "originator": "Infrastructuur",
        "dpa": false
      },
      {
        "attr": "pcn",
        "provider": "Airport Operator / CAA",
        "originator": "Engineering",
        "dpa": true
      }
    ],
    "adis": [
      {
        "module": "AIP Publisher",
        "attrs": [
          "designator",
          "length",
          "width",
          "surface",
          "pcn"